methodology_topic,search_date,query_family,query_text,language_or_circle,source_bucket,target_pattern,result_quality,next_step,notes
market-briefing-loop,2026-06-10,artifact,Schwab Market Update daily market update,en,institutional,daily_market_brief,high,extract,"Schwab describes a market update as start-of-day information: market news, stocks to watch, and what is ahead."
market-briefing-loop,2026-06-10,artifact,Schwab weekly trader outlook market review upcoming week,en,institutional,weekly_market_review,high,extract,"Schwab weekly outlook combines prior-week review, technical context, catalysts and next-week questions."
market-briefing-loop,2026-06-10,artifact,J.P. Morgan weekly market recap economic update,en,institutional,weekly_market_review,high,extract,"J.P. Morgan Asset Management describes weekly updates as snapshots of market/economic changes and investor implications."
market-briefing-loop,2026-06-10,artifact,BlackRock weekly market commentary,en,institutional,weekly_market_review,high,extract,"BlackRock Investment Institute maintains recurring weekly market commentary with market take, portfolio context and disclaimers."
market-briefing-loop,2026-06-10,artifact,Morningstar what's happening in markets this week economic calendar earnings,en,institutional,weekly_calendar,medium,extract,"Morningstar weekly planner emphasizes dated macro releases and company earnings calendar."
market-briefing-loop,2026-06-10,artifact,UBS daily outlook markets investments,en,institutional,daily_market_brief,medium,extract,"UBS House View Daily is positioned as daily coverage of significant market events and investment opportunities."
market-briefing-loop,2026-06-10,artifact,Fidelity weekly market update capital markets strategy,en,institutional,weekly_market_review,medium,extract,"Fidelity weekly updates cover recent market trends, economic developments and factors shaping investment decisions."
market-briefing-loop,2026-06-10,contradiction,market daily note failure modes stale price market commentary,en,first_principles,failure_mode,medium,encode,"Main failure mode is narrative-fitting stale or price-only moves; solve with live-data gate, attribution quality and escalation boundaries."
